<?xml version="1.0" encoding="UTF-8"?>
<!ELEMENT catalogo (libro+)>
<!ELEMENT libro (detalles)>
<!ATTLIST libro
    titulo CDATA #REQUIRED
    autor CDATA #REQUIRED
    aÃ±o CDATA #REQUIRED
    editorial CDATA #REQUIRED
    resumen CDATA #REQUIRED>
<!ELEMENT detalles (genero, paginas)>
<!ELEMENT genero (#PCDATA)>
<!ELEMENT paginas (#PCDATA)>